{
  "schema_version": "cpmt-0.2",
  "transaction_id": "tx-C09-relink-location",
  "intent": "REVISE",
  "template": "RELINK",
  "base_graph_version": "v0",
  "operations": [
    {
      "op_id": "close-old-location",
      "op_type": "CLOSE_EDGE_VERSION",
      "arguments": {"edge_id": "chair-location", "at": 5}
    },
    {
      "op_id": "record-old-location",
      "op_type": "RECORD_PROVENANCE",
      "arguments": {
        "target_kind": "edge",
        "edge_version_id": "chair-location@v0",
        "provenance_ref": "tx-C09-relink-location"
      }
    },
    {
      "op_id": "open-new-location",
      "op_type": "ADD_EDGE",
      "arguments": {
        "edge": {
          "edge_id": "chair-location",
          "edge_version_id": "chair-location@v1",
          "source": "chair-1",
          "target": "place-right",
          "relation": "located_at",
          "frame": "world",
          "valid_from": 5,
          "valid_to": null,
          "evidence_refs": ["obs:C09:t5:chair-misaligned"],
          "provenance": ["tx-C09-relink-location"]
        }
      }
    }
  ],
  "evidence_refs": ["obs:C09:t5:chair-misaligned"],
  "protected_ids": ["wall-protected"],
  "declared_edit_cost": 1,
  "declared_growth_cost": 0,
  "proposer": "human_draft"
}
